{
  "$schema": "../../schema/level.schema.json",
  "id": "tunnels-rotators-locks-007",
  "pack": "tunnels-rotators-locks",
  "index": 7,
  "formatVersion": 2,
  "size": {
    "width": 6,
    "height": 6
  },
  "dots": [
    {
      "color": 0,
      "start": [0, 0],
      "end": [5, 4]
    },
    {
      "color": 2,
      "start": [2, 2],
      "end": [4, 4]
    },
    {
      "color": 3,
      "start": [2, 3],
      "end": [2, 5]
    },
    {
      "color": 4,
      "start": [3, 5],
      "end": [5, 5]
    },
    {
      "color": 1,
      "start": [4, 1],
      "end": [4, 3]
    }
  ],
  "walls": [],
  "bridges": [],
  "warps": [],
  "teleporters": [],
  "tunnels": [
    {
      "cell": [0, 4],
      "start": "v"
    }
  ],
  "rotators": [
    {
      "cell": [3, 3],
      "start": "sw"
    }
  ],
  "locks": [
    {
      "key": [1, 1],
      "door": [2, 4]
    }
  ],
  "solution": {
    "0": [[0, 0], [1, 0], [2, 0], [3, 0], [4, 0], [5, 0], [5, 1], [5, 2], [5, 3], [5, 4]],
    "1": [[2, 2], [1, 2], [1, 3], [1, 4], [2, 4], [3, 4], [4, 4]],
    "2": [[2, 3], [3, 3], [3, 2], [3, 1], [2, 1], [1, 1], [0, 1], [0, 2], [0, 3], [0, 4], [0, 5], [1, 5], [2, 5]],
    "3": [[3, 5], [4, 5], [5, 5]],
    "4": [[4, 1], [4, 2], [4, 3]]
  },
  "difficulty": {
    "score": 17.6,
    "band": "easy",
    "metrics": {
      "cells": 36,
      "colors": 5,
      "avgPathLength": 7.2,
      "turnDensity": 0.194,
      "maxSolverTier": 2,
      "tierCounts": [30, 1, 0, 0],
      "searchNodes": 33,
      "forcedMoveRatio": 0.968
    }
  },
  "stars": {
    "perfectMoves": 5,
    "twoStarMoves": 8
  },
  "meta": {
    "seed": 1487774034,
    "generatorVersion": "2.0.0",
    "params": {
      "size": 6,
      "colors": [5, 6],
      "walls": 0,
      "bridges": 0,
      "warps": 0,
      "teleporters": 0,
      "tunnels": 1,
      "rotators": 1,
      "locks": 1
    },
    "loadBearing": true
  }
}
