{
  "$schema": "../../schema/level.schema.json",
  "id": "locks-002",
  "pack": "locks",
  "index": 2,
  "formatVersion": 2,
  "size": {
    "width": 10,
    "height": 10
  },
  "dots": [
    {
      "color": 1,
      "start": [1, 6],
      "end": [1, 9]
    },
    {
      "color": 2,
      "start": [1, 8],
      "end": [2, 6]
    },
    {
      "color": 6,
      "start": [2, 2],
      "end": [6, 6]
    },
    {
      "color": 5,
      "start": [2, 8],
      "end": [9, 8]
    },
    {
      "color": 7,
      "start": [3, 4],
      "end": [7, 2]
    },
    {
      "color": 0,
      "start": [3, 6],
      "end": [8, 3]
    },
    {
      "color": 4,
      "start": [3, 7],
      "end": [7, 7]
    },
    {
      "color": 8,
      "start": [4, 7],
      "end": [6, 4]
    },
    {
      "color": 3,
      "start": [5, 0],
      "end": [9, 7]
    }
  ],
  "walls": [],
  "bridges": [],
  "warps": [],
  "teleporters": [],
  "tunnels": [],
  "rotators": [],
  "locks": [
    {
      "key": [6, 8],
      "door": [3, 8]
    }
  ],
  "solution": {
    "0": [[1, 6], [0, 6], [0, 7], [0, 8], [0, 9], [1, 9]],
    "1": [[1, 8], [1, 7], [2, 7], [2, 6]],
    "2": [[2, 2], [2, 3], [3, 3], [4, 3], [5, 3], [6, 3], [7, 3], [7, 4], [8, 4], [8, 5], [8, 6], [8, 7], [8, 8], [7, 8], [6, 8], [6, 7], [6, 6]],
    "3": [[2, 8], [2, 9], [3, 9], [4, 9], [5, 9], [6, 9], [7, 9], [8, 9], [9, 9], [9, 8]],
    "4": [[3, 4], [2, 4], [1, 4], [1, 3], [1, 2], [1, 1], [2, 1], [3, 1], [3, 2], [4, 2], [5, 2], [6, 2], [7, 2]],
    "5": [[3, 6], [3, 5], [2, 5], [1, 5], [0, 5], [0, 4], [0, 3], [0, 2], [0, 1], [0, 0], [1, 0], [2, 0], [3, 0], [4, 0], [4, 1], [5, 1], [6, 1], [7, 1], [8, 1], [8, 2], [8, 3]],
    "6": [[3, 7], [3, 8], [4, 8], [5, 8], [5, 7], [5, 6], [5, 5], [6, 5], [7, 5], [7, 6], [7, 7]],
    "7": [[4, 7], [4, 6], [4, 5], [4, 4], [5, 4], [6, 4]],
    "8": [[5, 0], [6, 0], [7, 0], [8, 0], [9, 0], [9, 1], [9, 2], [9, 3], [9, 4], [9, 5], [9, 6], [9, 7]]
  },
  "difficulty": {
    "score": 48.1,
    "band": "medium",
    "metrics": {
      "cells": 100,
      "colors": 9,
      "avgPathLength": 11.11,
      "turnDensity": 0.28,
      "maxSolverTier": 4,
      "tierCounts": [83, 1, 2, 5],
      "searchNodes": 92,
      "forcedMoveRatio": 0.912
    }
  },
  "stars": {
    "perfectMoves": 9,
    "twoStarMoves": 14
  },
  "meta": {
    "seed": 1530451886,
    "generatorVersion": "2.0.0",
    "params": {
      "size": 10,
      "colors": [7, 9],
      "walls": 0,
      "bridges": 0,
      "warps": 0,
      "teleporters": 0,
      "tunnels": 0,
      "rotators": 0,
      "locks": 1
    },
    "loadBearing": true
  }
}
