{
  "$schema": "../../schema/level.schema.json",
  "id": "walls-teleporters-009",
  "pack": "walls-teleporters",
  "index": 9,
  "formatVersion": 2,
  "size": {
    "width": 6,
    "height": 6
  },
  "dots": [
    {
      "color": 0,
      "start": [0, 0],
      "end": [3, 3]
    },
    {
      "color": 1,
      "start": [1, 1],
      "end": [2, 0]
    },
    {
      "color": 3,
      "start": [1, 5],
      "end": [3, 4]
    },
    {
      "color": 4,
      "start": [2, 1],
      "end": [3, 0]
    },
    {
      "color": 2,
      "start": [2, 3],
      "end": [4, 4]
    },
    {
      "color": 5,
      "start": [3, 5],
      "end": [5, 0]
    }
  ],
  "walls": [[0, 5], [0, 3]],
  "bridges": [],
  "warps": [],
  "teleporters": [
    {
      "a": [4, 0],
      "b": [0, 4]
    }
  ],
  "tunnels": [],
  "rotators": [],
  "locks": [],
  "solution": {
    "0": [[0, 0], [0, 1], [0, 2], [1, 2], [2, 2], [3, 2], [3, 3]],
    "1": [[1, 1], [1, 0], [2, 0]],
    "2": [[1, 5], [2, 5], [2, 4], [3, 4]],
    "3": [[2, 1], [3, 1], [3, 0]],
    "4": [[2, 3], [1, 3], [1, 4], [0, 4], [4, 0], [4, 1], [4, 2], [4, 3], [4, 4]],
    "5": [[3, 5], [4, 5], [5, 5], [5, 4], [5, 3], [5, 2], [5, 1], [5, 0]]
  },
  "difficulty": {
    "score": 17.9,
    "band": "easy",
    "metrics": {
      "cells": 34,
      "colors": 6,
      "avgPathLength": 5.67,
      "turnDensity": 0.265,
      "maxSolverTier": 2,
      "tierCounts": [26, 2, 0, 0],
      "searchNodes": 29,
      "forcedMoveRatio": 0.929
    }
  },
  "stars": {
    "perfectMoves": 6,
    "twoStarMoves": 9
  },
  "meta": {
    "seed": 3075952915,
    "generatorVersion": "2.0.0",
    "params": {
      "size": 6,
      "colors": [5, 6],
      "walls": 2,
      "bridges": 0,
      "warps": 0,
      "teleporters": 1,
      "tunnels": 0,
      "rotators": 0,
      "locks": 0
    }
  }
}
