{
  "$schema": "../../schema/level.schema.json",
  "id": "bridges-tunnels-011",
  "pack": "bridges-tunnels",
  "index": 11,
  "formatVersion": 2,
  "size": {
    "width": 6,
    "height": 6
  },
  "dots": [
    {
      "color": 2,
      "start": [0, 5],
      "end": [2, 5]
    },
    {
      "color": 1,
      "start": [1, 1],
      "end": [4, 1]
    },
    {
      "color": 3,
      "start": [1, 4],
      "end": [5, 2]
    },
    {
      "color": 0,
      "start": [3, 1],
      "end": [5, 3]
    },
    {
      "color": 4,
      "start": [3, 5],
      "end": [5, 4]
    }
  ],
  "walls": [],
  "bridges": [[2, 3]],
  "warps": [],
  "teleporters": [],
  "tunnels": [
    {
      "cell": [5, 1],
      "start": "v"
    }
  ],
  "rotators": [],
  "locks": [],
  "solution": {
    "0": [[0, 5], [1, 5], [2, 5]],
    "1": [[1, 1], [1, 2], [1, 3], [2, 3], [3, 3], [3, 2], [4, 2], [4, 1]],
    "2": [[1, 4], [0, 4], [0, 3], [0, 2], [0, 1], [0, 0], [1, 0], [2, 0], [3, 0], [4, 0], [5, 0], [5, 1], [5, 2]],
    "3": [[3, 1], [2, 1], [2, 2], [2, 3], [2, 4], [3, 4], [4, 4], [4, 3], [5, 3]],
    "4": [[3, 5], [4, 5], [5, 5], [5, 4]]
  },
  "difficulty": {
    "score": 14.3,
    "band": "relaxed",
    "metrics": {
      "cells": 36,
      "colors": 5,
      "avgPathLength": 7.4,
      "turnDensity": 0.324,
      "maxSolverTier": 1,
      "tierCounts": [32, 0, 0, 0],
      "searchNodes": 33,
      "forcedMoveRatio": 1
    }
  },
  "stars": {
    "perfectMoves": 5,
    "twoStarMoves": 8
  },
  "meta": {
    "seed": 52294576,
    "generatorVersion": "2.0.0",
    "params": {
      "size": 6,
      "colors": [5, 6],
      "walls": 0,
      "bridges": 1,
      "warps": 0,
      "teleporters": 0,
      "tunnels": 1,
      "rotators": 0,
      "locks": 0
    },
    "loadBearing": true
  }
}
