{
  "$schema": "../../schema/level.schema.json",
  "id": "teleporters-tunnels-038",
  "pack": "teleporters-tunnels",
  "index": 38,
  "formatVersion": 2,
  "size": {
    "width": 11,
    "height": 11
  },
  "dots": [
    {
      "color": 9,
      "start": [1, 6],
      "end": [6, 9]
    },
    {
      "color": 5,
      "start": [1, 10],
      "end": [4, 9]
    },
    {
      "color": 1,
      "start": [2, 0],
      "end": [4, 8]
    },
    {
      "color": 0,
      "start": [2, 2],
      "end": [6, 8]
    },
    {
      "color": 8,
      "start": [2, 3],
      "end": [6, 3]
    },
    {
      "color": 7,
      "start": [4, 0],
      "end": [8, 10]
    },
    {
      "color": 6,
      "start": [4, 2],
      "end": [6, 10]
    },
    {
      "color": 3,
      "start": [4, 6],
      "end": [5, 8]
    },
    {
      "color": 4,
      "start": [5, 4],
      "end": [8, 8]
    },
    {
      "color": 2,
      "start": [8, 2],
      "end": [8, 7]
    }
  ],
  "walls": [],
  "bridges": [],
  "warps": [],
  "teleporters": [
    {
      "a": [6, 4],
      "b": [3, 0]
    }
  ],
  "tunnels": [
    {
      "cell": [0, 1],
      "start": "v"
    },
    {
      "cell": [6, 1],
      "start": "h"
    },
    {
      "cell": [0, 3],
      "start": "v"
    }
  ],
  "rotators": [],
  "locks": [],
  "solution": {
    "0": [[1, 6], [1, 7], [1, 8], [1, 9], [2, 9], [2, 10], [3, 10], [4, 10], [5, 10], [5, 9], [6, 9]],
    "1": [[1, 10], [0, 10], [0, 9], [0, 8], [0, 7], [0, 6], [0, 5], [1, 5], [2, 5], [2, 6], [2, 7], [2, 8], [3, 8], [3, 9], [4, 9]],
    "2": [[2, 0], [1, 0], [0, 0], [0, 1], [0, 2], [0, 3], [0, 4], [1, 4], [2, 4], [3, 4], [3, 5], [3, 6], [3, 7], [4, 7], [4, 8]],
    "3": [[2, 2], [3, 2], [3, 3], [4, 3], [4, 4], [4, 5], [5, 5], [6, 5], [6, 6], [6, 7], [6, 8]],
    "4": [[2, 3], [1, 3], [1, 2], [1, 1], [2, 1], [3, 1], [3, 0], [6, 4], [6, 3]],
    "5": [[4, 0], [5, 0], [6, 0], [7, 0], [8, 0], [9, 0], [10, 0], [10, 1], [10, 2], [10, 3], [10, 4], [10, 5], [10, 6], [10, 7], [10, 8], [10, 9], [10, 10], [9, 10], [8, 10]],
    "6": [[4, 2], [4, 1], [5, 1], [6, 1], [7, 1], [8, 1], [9, 1], [9, 2], [9, 3], [9, 4], [9, 5], [9, 6], [9, 7], [9, 8], [9, 9], [8, 9], [7, 9], [7, 10], [6, 10]],
    "7": [[4, 6], [5, 6], [5, 7], [5, 8]],
    "8": [[5, 4], [5, 3], [5, 2], [6, 2], [7, 2], [7, 3], [7, 4], [7, 5], [7, 6], [7, 7], [7, 8], [8, 8]],
    "9": [[8, 2], [8, 3], [8, 4], [8, 5], [8, 6], [8, 7]]
  },
  "difficulty": {
    "score": 58.3,
    "band": "hard",
    "metrics": {
      "cells": 121,
      "colors": 10,
      "avgPathLength": 12.1,
      "turnDensity": 0.289,
      "maxSolverTier": 4,
      "tierCounts": [101, 0, 7, 3],
      "searchNodes": 699,
      "forcedMoveRatio": 0.91
    }
  },
  "stars": {
    "perfectMoves": 10,
    "twoStarMoves": 15
  },
  "meta": {
    "seed": 3094968339,
    "generatorVersion": "2.0.0",
    "params": {
      "size": 11,
      "colors": [9, 11],
      "walls": 0,
      "bridges": 0,
      "warps": 0,
      "teleporters": 1,
      "tunnels": 3,
      "rotators": 0,
      "locks": 0
    },
    "loadBearing": true
  }
}
