{
  "$schema": "../../schema/level.schema.json",
  "id": "walls-warps-015",
  "pack": "walls-warps",
  "index": 15,
  "formatVersion": 1,
  "size": {
    "width": 10,
    "height": 10
  },
  "dots": [
    {
      "color": 9,
      "start": [0, 2],
      "end": [8, 6]
    },
    {
      "color": 2,
      "start": [2, 0],
      "end": [7, 9]
    },
    {
      "color": 0,
      "start": [2, 8],
      "end": [3, 3]
    },
    {
      "color": 3,
      "start": [3, 2],
      "end": [3, 7]
    },
    {
      "color": 6,
      "start": [3, 4],
      "end": [8, 5]
    },
    {
      "color": 7,
      "start": [4, 4],
      "end": [5, 6]
    },
    {
      "color": 4,
      "start": [5, 2],
      "end": [8, 3]
    },
    {
      "color": 8,
      "start": [5, 3],
      "end": [6, 6]
    },
    {
      "color": 5,
      "start": [7, 4],
      "end": [8, 9]
    },
    {
      "color": 1,
      "start": [8, 1],
      "end": [9, 3]
    }
  ],
  "walls": [[6, 0], [3, 0], [6, 3]],
  "bridges": [],
  "warps": [
    {
      "axis": "row",
      "index": 4
    },
    {
      "axis": "col",
      "index": 1
    }
  ],
  "solution": {
    "0": [[0, 2], [0, 3], [0, 4], [0, 5], [0, 6], [0, 7], [0, 8], [0, 9], [1, 9], [2, 9], [3, 9], [3, 8], [4, 8], [5, 8], [6, 8], [7, 8], [8, 8], [8, 7], [8, 6]],
    "1": [[2, 0], [1, 0], [0, 0], [0, 1], [9, 1], [9, 0], [8, 0], [7, 0], [7, 1], [6, 1], [5, 1], [5, 0], [4, 0], [4, 9], [5, 9], [6, 9], [7, 9]],
    "2": [[2, 8], [1, 8], [1, 7], [1, 6], [1, 5], [1, 4], [1, 3], [1, 2], [1, 1], [2, 1], [3, 1], [4, 1], [4, 2], [4, 3], [3, 3]],
    "3": [[3, 2], [2, 2], [2, 3], [2, 4], [2, 5], [2, 6], [2, 7], [3, 7]],
    "4": [[3, 4], [3, 5], [3, 6], [4, 6], [4, 7], [5, 7], [6, 7], [7, 7], [7, 6], [7, 5], [8, 5]],
    "5": [[4, 4], [4, 5], [5, 5], [5, 6]],
    "6": [[5, 2], [6, 2], [7, 2], [7, 3], [8, 3]],
    "7": [[5, 3], [5, 4], [6, 4], [6, 5], [6, 6]],
    "8": [[7, 4], [8, 4], [9, 4], [9, 5], [9, 6], [9, 7], [9, 8], [9, 9], [8, 9]],
    "9": [[8, 1], [8, 2], [9, 2], [9, 3]]
  },
  "difficulty": {
    "score": 58.5,
    "band": "hard",
    "metrics": {
      "cells": 97,
      "colors": 10,
      "avgPathLength": 9.7,
      "turnDensity": 0.361,
      "maxSolverTier": 4,
      "tierCounts": [71, 1, 12, 3],
      "searchNodes": 333,
      "forcedMoveRatio": 0.816
    }
  },
  "stars": {
    "perfectMoves": 10,
    "twoStarMoves": 15
  },
  "meta": {
    "seed": 2727909523,
    "generatorVersion": "1.0.0",
    "params": {
      "size": 10,
      "colors": [7, 10],
      "walls": 3,
      "bridges": 0,
      "warps": 2
    }
  }
}
