{
  "$schema": "../../schema/level.schema.json",
  "id": "walls-teleporters-tunnels-024",
  "pack": "walls-teleporters-tunnels",
  "index": 24,
  "formatVersion": 2,
  "size": {
    "width": 8,
    "height": 8
  },
  "dots": [
    {
      "color": 0,
      "start": [0, 1],
      "end": [7, 4]
    },
    {
      "color": 7,
      "start": [0, 3],
      "end": [3, 5]
    },
    {
      "color": 6,
      "start": [0, 6],
      "end": [7, 5]
    },
    {
      "color": 5,
      "start": [1, 1],
      "end": [7, 0]
    },
    {
      "color": 1,
      "start": [1, 5],
      "end": [3, 4]
    },
    {
      "color": 2,
      "start": [3, 2],
      "end": [5, 5]
    },
    {
      "color": 3,
      "start": [4, 3],
      "end": [5, 1]
    },
    {
      "color": 4,
      "start": [5, 6],
      "end": [6, 4]
    }
  ],
  "walls": [[0, 5], [0, 2]],
  "bridges": [],
  "warps": [],
  "teleporters": [
    {
      "a": [1, 3],
      "b": [7, 2]
    }
  ],
  "tunnels": [
    {
      "cell": [3, 7],
      "start": "h"
    }
  ],
  "rotators": [],
  "locks": [],
  "solution": {
    "0": [[0, 1], [0, 0], [1, 0], [2, 0], [3, 0], [4, 0], [5, 0], [6, 0], [6, 1], [6, 2], [6, 3], [7, 3], [7, 4]],
    "1": [[0, 3], [0, 4], [1, 4], [2, 4], [2, 5], [3, 5]],
    "2": [[0, 6], [0, 7], [1, 7], [2, 7], [3, 7], [4, 7], [5, 7], [6, 7], [7, 7], [7, 6], [7, 5]],
    "3": [[1, 1], [1, 2], [1, 3], [7, 2], [7, 1], [7, 0]],
    "4": [[1, 5], [1, 6], [2, 6], [3, 6], [4, 6], [4, 5], [4, 4], [3, 4]],
    "5": [[3, 2], [4, 2], [5, 2], [5, 3], [5, 4], [5, 5]],
    "6": [[4, 3], [3, 3], [2, 3], [2, 2], [2, 1], [3, 1], [4, 1], [5, 1]],
    "7": [[5, 6], [6, 6], [6, 5], [6, 4]]
  },
  "difficulty": {
    "score": 45.6,
    "band": "medium",
    "metrics": {
      "cells": 62,
      "colors": 8,
      "avgPathLength": 7.75,
      "turnDensity": 0.258,
      "maxSolverTier": 4,
      "tierCounts": [44, 0, 6, 4],
      "searchNodes": 55,
      "forcedMoveRatio": 0.815
    }
  },
  "stars": {
    "perfectMoves": 8,
    "twoStarMoves": 12
  },
  "meta": {
    "seed": 1883149729,
    "generatorVersion": "2.0.0",
    "params": {
      "size": 8,
      "colors": [6, 8],
      "walls": 2,
      "bridges": 0,
      "warps": 0,
      "teleporters": 1,
      "tunnels": 1,
      "rotators": 0,
      "locks": 0
    },
    "loadBearing": true
  }
}
