{
  "$schema": "../../schema/level.schema.json",
  "id": "all-023",
  "pack": "all",
  "index": 23,
  "formatVersion": 2,
  "size": {
    "width": 12,
    "height": 13
  },
  "dots": [
    {
      "color": 4,
      "start": [0, 9],
      "end": [2, 5]
    },
    {
      "color": 6,
      "start": [1, 1],
      "end": [11, 7]
    },
    {
      "color": 2,
      "start": [1, 11],
      "end": [8, 9]
    },
    {
      "color": 3,
      "start": [2, 9],
      "end": [6, 10]
    },
    {
      "color": 1,
      "start": [4, 0],
      "end": [12, 4]
    },
    {
      "color": 11,
      "start": [4, 5],
      "end": [6, 2]
    },
    {
      "color": 0,
      "start": [4, 9],
      "end": [9, 1]
    },
    {
      "color": 7,
      "start": [5, 4],
      "end": [7, 1]
    },
    {
      "color": 5,
      "start": [6, 1],
      "end": [6, 4]
    },
    {
      "color": 10,
      "start": [6, 6],
      "end": [9, 2]
    },
    {
      "color": 8,
      "start": [6, 8],
      "end": [7, 10]
    },
    {
      "color": 9,
      "start": [10, 1],
      "end": [10, 10]
    }
  ],
  "walls": [[8, 11], [3, 0], [1, 7]],
  "bridges": [[11, 9], [9, 5]],
  "warps": [
    {
      "axis": "col",
      "index": 10
    }
  ],
  "teleporters": [
    {
      "a": [8, 2],
      "b": [12, 0]
    }
  ],
  "tunnels": [
    {
      "cell": [3, 7],
      "start": "h"
    },
    {
      "cell": [5, 0],
      "start": "h"
    },
    {
      "cell": [12, 8],
      "start": "v"
    }
  ],
  "rotators": [
    {
      "cell": [3, 9],
      "start": "sw"
    },
    {
      "cell": [5, 3],
      "start": "ne"
    },
    {
      "cell": [10, 8],
      "start": "nw"
    }
  ],
  "locks": [
    {
      "key": [2, 2],
      "door": [9, 11]
    }
  ],
  "solution": {
    "0": [[0, 9], [0, 8], [0, 7], [0, 6], [0, 5], [0, 4], [0, 3], [0, 2], [0, 1], [0, 0], [1, 0], [2, 0], [2, 1], [2, 2], [2, 3], [2, 4], [2, 5]],
    "1": [[1, 1], [1, 2], [1, 3], [1, 4], [1, 5], [1, 6], [2, 6], [2, 7], [3, 7], [4, 7], [5, 7], [6, 7], [7, 7], [8, 7], [8, 6], [8, 5], [9, 5], [10, 5], [10, 6], [11, 6], [11, 7]],
    "2": [[1, 11], [0, 11], [0, 10], [12, 10], [12, 11], [11, 11], [10, 11], [9, 11], [9, 10], [8, 10], [8, 9]],
    "3": [[2, 9], [3, 9], [3, 10], [4, 10], [5, 10], [6, 10]],
    "4": [[4, 0], [5, 0], [6, 0], [7, 0], [8, 0], [8, 1], [8, 2], [12, 0], [12, 1], [12, 2], [12, 3], [12, 4]],
    "5": [[4, 5], [4, 4], [4, 3], [4, 2], [5, 2], [6, 2]],
    "6": [[4, 9], [5, 9], [6, 9], [7, 9], [7, 8], [8, 8], [9, 8], [9, 9], [10, 9], [11, 9], [12, 9], [12, 8], [12, 7], [12, 6], [12, 5], [11, 5], [11, 4], [11, 3], [11, 2], [11, 1], [11, 0], [10, 0], [9, 0], [9, 1]],
    "7": [[5, 4], [5, 3], [6, 3], [7, 3], [7, 2], [7, 1]],
    "8": [[6, 1], [5, 1], [4, 1], [3, 1], [3, 2], [3, 3], [3, 4], [3, 5], [3, 6], [4, 6], [5, 6], [5, 5], [6, 5], [6, 4]],
    "9": [[6, 6], [7, 6], [7, 5], [7, 4], [8, 4], [8, 3], [9, 3], [9, 2]],
    "10": [[6, 8], [5, 8], [4, 8], [3, 8], [2, 8], [1, 8], [1, 9], [1, 10], [2, 10], [2, 11], [3, 11], [4, 11], [5, 11], [6, 11], [7, 11], [7, 10]],
    "11": [[10, 1], [10, 2], [10, 3], [10, 4], [9, 4], [9, 5], [9, 6], [9, 7], [10, 7], [10, 8], [11, 8], [11, 9], [11, 10], [10, 10]]
  },
  "difficulty": {
    "score": 68,
    "band": "hard",
    "metrics": {
      "cells": 153,
      "colors": 12,
      "avgPathLength": 12.92,
      "turnDensity": 0.348,
      "maxSolverTier": 4,
      "tierCounts": [131, 2, 4, 6],
      "searchNodes": 5823,
      "forcedMoveRatio": 0.916
    }
  },
  "stars": {
    "perfectMoves": 12,
    "twoStarMoves": 18
  },
  "meta": {
    "seed": 1032728796,
    "generatorVersion": "2.0.0",
    "params": {
      "size": 12,
      "colors": [10, 12],
      "walls": 3,
      "bridges": 2,
      "warps": 1,
      "teleporters": 1,
      "tunnels": 3,
      "rotators": 3,
      "locks": 1
    },
    "loadBearing": true
  }
}
