{
  "$schema": "../../schema/level.schema.json",
  "id": "bridges-teleporters-048",
  "pack": "bridges-teleporters",
  "index": 48,
  "formatVersion": 2,
  "size": {
    "width": 12,
    "height": 12
  },
  "dots": [
    {
      "color": 3,
      "start": [0, 5],
      "end": [3, 0]
    },
    {
      "color": 6,
      "start": [0, 7],
      "end": [2, 8]
    },
    {
      "color": 5,
      "start": [0, 11],
      "end": [6, 7]
    },
    {
      "color": 2,
      "start": [1, 3],
      "end": [10, 9]
    },
    {
      "color": 0,
      "start": [1, 5],
      "end": [9, 2]
    },
    {
      "color": 10,
      "start": [1, 9],
      "end": [5, 7]
    },
    {
      "color": 4,
      "start": [1, 11],
      "end": [10, 10]
    },
    {
      "color": 9,
      "start": [2, 2],
      "end": [8, 5]
    },
    {
      "color": 8,
      "start": [2, 5],
      "end": [7, 3]
    },
    {
      "color": 7,
      "start": [3, 2],
      "end": [10, 1]
    },
    {
      "color": 1,
      "start": [4, 8],
      "end": [6, 8]
    },
    {
      "color": 11,
      "start": [9, 11],
      "end": [11, 3]
    }
  ],
  "walls": [],
  "bridges": [[7, 6], [8, 10], [3, 7]],
  "warps": [],
  "teleporters": [
    {
      "a": [2, 4],
      "b": [2, 11]
    }
  ],
  "tunnels": [],
  "rotators": [],
  "locks": [],
  "solution": {
    "0": [[0, 5], [0, 4], [0, 3], [0, 2], [0, 1], [0, 0], [1, 0], [2, 0], [3, 0]],
    "1": [[0, 7], [0, 6], [1, 6], [2, 6], [3, 6], [3, 7], [3, 8], [2, 8]],
    "2": [[0, 11], [0, 10], [0, 9], [0, 8], [1, 8], [1, 7], [2, 7], [3, 7], [4, 7], [4, 6], [4, 5], [5, 5], [6, 5], [7, 5], [7, 6], [7, 7], [6, 7]],
    "3": [[1, 3], [1, 2], [1, 1], [2, 1], [3, 1], [4, 1], [4, 0], [5, 0], [6, 0], [7, 0], [8, 0], [9, 0], [10, 0], [11, 0], [11, 1], [11, 2], [10, 2], [10, 3], [10, 4], [10, 5], [10, 6], [10, 7], [10, 8], [10, 9]],
    "4": [[1, 5], [1, 4], [2, 4], [2, 11], [3, 11], [4, 11], [5, 11], [6, 11], [7, 11], [8, 11], [8, 10], [8, 9], [9, 9], [9, 8], [9, 7], [9, 6], [9, 5], [9, 4], [9, 3], [9, 2]],
    "5": [[1, 9], [2, 9], [3, 9], [4, 9], [5, 9], [6, 9], [7, 9], [7, 8], [8, 8], [8, 7], [8, 6], [7, 6], [6, 6], [5, 6], [5, 7]],
    "6": [[1, 11], [1, 10], [2, 10], [3, 10], [4, 10], [5, 10], [6, 10], [7, 10], [8, 10], [9, 10], [10, 10]],
    "7": [[2, 2], [2, 3], [3, 3], [4, 3], [5, 3], [6, 3], [6, 2], [7, 2], [8, 2], [8, 3], [8, 4], [8, 5]],
    "8": [[2, 5], [3, 5], [3, 4], [4, 4], [5, 4], [6, 4], [7, 4], [7, 3]],
    "9": [[3, 2], [4, 2], [5, 2], [5, 1], [6, 1], [7, 1], [8, 1], [9, 1], [10, 1]],
    "10": [[4, 8], [5, 8], [6, 8]],
    "11": [[9, 11], [10, 11], [11, 11], [11, 10], [11, 9], [11, 8], [11, 7], [11, 6], [11, 5], [11, 4], [11, 3]]
  },
  "difficulty": {
    "score": 60.4,
    "band": "hard",
    "metrics": {
      "cells": 144,
      "colors": 12,
      "avgPathLength": 12.25,
      "turnDensity": 0.252,
      "maxSolverTier": 4,
      "tierCounts": [124, 1, 8, 2],
      "searchNodes": 225,
      "forcedMoveRatio": 0.919
    }
  },
  "stars": {
    "perfectMoves": 12,
    "twoStarMoves": 18
  },
  "meta": {
    "seed": 1993728795,
    "generatorVersion": "2.0.0",
    "params": {
      "size": 12,
      "colors": [10, 12],
      "walls": 0,
      "bridges": 3,
      "warps": 0,
      "teleporters": 1,
      "tunnels": 0,
      "rotators": 0,
      "locks": 0
    }
  }
}
