{
  "$schema": "../../schema/level.schema.json",
  "id": "rotators-locks-050",
  "pack": "rotators-locks",
  "index": 50,
  "formatVersion": 2,
  "size": {
    "width": 12,
    "height": 12
  },
  "dots": [
    {
      "color": 4,
      "start": [0, 4],
      "end": [11, 3]
    },
    {
      "color": 10,
      "start": [1, 7],
      "end": [8, 2]
    },
    {
      "color": 3,
      "start": [2, 1],
      "end": [7, 11]
    },
    {
      "color": 0,
      "start": [2, 9],
      "end": [9, 2]
    },
    {
      "color": 6,
      "start": [3, 1],
      "end": [11, 5]
    },
    {
      "color": 1,
      "start": [3, 3],
      "end": [8, 9]
    },
    {
      "color": 2,
      "start": [4, 9],
      "end": [9, 6]
    },
    {
      "color": 11,
      "start": [5, 5],
      "end": [6, 4]
    },
    {
      "color": 9,
      "start": [5, 6],
      "end": [9, 4]
    },
    {
      "color": 8,
      "start": [5, 7],
      "end": [10, 10]
    },
    {
      "color": 7,
      "start": [7, 10],
      "end": [10, 9]
    },
    {
      "color": 5,
      "start": [11, 6],
      "end": [11, 8]
    }
  ],
  "walls": [],
  "bridges": [],
  "warps": [],
  "teleporters": [],
  "tunnels": [],
  "rotators": [
    {
      "cell": [5, 4],
      "start": "ne"
    },
    {
      "cell": [5, 9],
      "start": "ne"
    },
    {
      "cell": [9, 8],
      "start": "ne"
    }
  ],
  "locks": [
    {
      "key": [7, 9],
      "door": [1, 4]
    },
    {
      "key": [10, 11],
      "door": [6, 11]
    }
  ],
  "solution": {
    "0": [[0, 4], [0, 3], [0, 2], [0, 1], [0, 0], [1, 0], [2, 0], [3, 0], [4, 0], [5, 0], [6, 0], [7, 0], [8, 0], [9, 0], [10, 0], [11, 0], [11, 1], [11, 2], [11, 3]],
    "1": [[1, 7], [1, 6], [2, 6], [2, 5], [2, 4], [2, 3], [2, 2], [3, 2], [4, 2], [5, 2], [6, 2], [7, 2], [8, 2]],
    "2": [[2, 1], [1, 1], [1, 2], [1, 3], [1, 4], [1, 5], [0, 5], [0, 6], [0, 7], [0, 8], [0, 9], [0, 10], [0, 11], [1, 11], [2, 11], [3, 11], [4, 11], [5, 11], [6, 11], [7, 11]],
    "3": [[2, 9], [3, 9], [3, 8], [4, 8], [4, 7], [4, 6], [4, 5], [4, 4], [4, 3], [5, 3], [6, 3], [7, 3], [8, 3], [9, 3], [9, 2]],
    "4": [[3, 1], [4, 1], [5, 1], [6, 1], [7, 1], [8, 1], [9, 1], [10, 1], [10, 2], [10, 3], [10, 4], [11, 4], [11, 5]],
    "5": [[3, 3], [3, 4], [3, 5], [3, 6], [3, 7], [2, 7], [2, 8], [1, 8], [1, 9], [1, 10], [2, 10], [3, 10], [4, 10], [5, 10], [6, 10], [6, 9], [7, 9], [8, 9]],
    "6": [[4, 9], [5, 9], [5, 8], [6, 8], [7, 8], [8, 8], [8, 7], [9, 7], [9, 6]],
    "7": [[5, 5], [5, 4], [6, 4]],
    "8": [[5, 6], [6, 6], [6, 5], [7, 5], [7, 4], [8, 4], [9, 4]],
    "9": [[5, 7], [6, 7], [7, 7], [7, 6], [8, 6], [8, 5], [9, 5], [10, 5], [10, 6], [10, 7], [10, 8], [9, 8], [9, 9], [9, 10], [10, 10]],
    "10": [[7, 10], [8, 10], [8, 11], [9, 11], [10, 11], [11, 11], [11, 10], [11, 9], [10, 9]],
    "11": [[11, 6], [11, 7], [11, 8]]
  },
  "difficulty": {
    "score": 68.7,
    "band": "hard",
    "metrics": {
      "cells": 144,
      "colors": 12,
      "avgPathLength": 12,
      "turnDensity": 0.319,
      "maxSolverTier": 4,
      "tierCounts": [98, 3, 24, 7],
      "searchNodes": 6307,
      "forcedMoveRatio": 0.742
    }
  },
  "stars": {
    "perfectMoves": 12,
    "twoStarMoves": 18
  },
  "meta": {
    "seed": 1029706799,
    "generatorVersion": "2.0.0",
    "params": {
      "size": 12,
      "colors": [10, 12],
      "walls": 0,
      "bridges": 0,
      "warps": 0,
      "teleporters": 0,
      "tunnels": 0,
      "rotators": 3,
      "locks": 2
    },
    "loadBearing": true
  }
}
