{
  "$schema": "../../schema/level.schema.json",
  "id": "walls-teleporters-locks-047",
  "pack": "walls-teleporters-locks",
  "index": 47,
  "formatVersion": 2,
  "size": {
    "width": 12,
    "height": 12
  },
  "dots": [
    {
      "color": 1,
      "start": [0, 4],
      "end": [5, 0]
    },
    {
      "color": 7,
      "start": [0, 11],
      "end": [3, 3]
    },
    {
      "color": 11,
      "start": [1, 3],
      "end": [2, 1]
    },
    {
      "color": 8,
      "start": [2, 10],
      "end": [11, 10]
    },
    {
      "color": 10,
      "start": [3, 8],
      "end": [9, 5]
    },
    {
      "color": 6,
      "start": [4, 10],
      "end": [5, 2]
    },
    {
      "color": 9,
      "start": [5, 3],
      "end": [8, 1]
    },
    {
      "color": 4,
      "start": [5, 10],
      "end": [10, 3]
    },
    {
      "color": 3,
      "start": [6, 0],
      "end": [10, 1]
    },
    {
      "color": 2,
      "start": [6, 6],
      "end": [8, 3]
    },
    {
      "color": 0,
      "start": [7, 1],
      "end": [10, 0]
    },
    {
      "color": 5,
      "start": [7, 3],
      "end": [11, 7]
    }
  ],
  "walls": [[2, 5], [8, 6], [9, 9], [7, 6]],
  "bridges": [],
  "warps": [],
  "teleporters": [
    {
      "a": [0, 10],
      "b": [10, 5]
    },
    {
      "a": [8, 9],
      "b": [5, 8]
    }
  ],
  "tunnels": [],
  "rotators": [],
  "locks": [
    {
      "key": [9, 8],
      "door": [2, 4]
    }
  ],
  "solution": {
    "0": [[0, 4], [0, 3], [0, 2], [0, 1], [0, 0], [1, 0], [2, 0], [3, 0], [4, 0], [5, 0]],
    "1": [[0, 11], [1, 11], [1, 10], [1, 9], [1, 8], [1, 7], [1, 6], [2, 6], [3, 6], [3, 5], [3, 4], [3, 3]],
    "2": [[1, 3], [1, 2], [1, 1], [2, 1]],
    "3": [[2, 10], [2, 11], [3, 11], [4, 11], [5, 11], [6, 11], [7, 11], [8, 11], [9, 11], [10, 11], [11, 11], [11, 10]],
    "4": [[3, 8], [4, 8], [4, 9], [5, 9], [6, 9], [6, 8], [6, 7], [7, 7], [8, 7], [9, 7], [9, 6], [9, 5]],
    "5": [[4, 10], [3, 10], [3, 9], [2, 9], [2, 8], [2, 7], [3, 7], [4, 7], [4, 6], [4, 5], [4, 4], [4, 3], [4, 2], [5, 2]],
    "6": [[5, 3], [6, 3], [6, 2], [7, 2], [8, 2], [8, 1]],
    "7": [[5, 10], [6, 10], [7, 10], [7, 9], [7, 8], [8, 8], [9, 8], [10, 8], [10, 7], [10, 6], [11, 6], [11, 5], [11, 4], [11, 3], [10, 3]],
    "8": [[6, 0], [7, 0], [8, 0], [9, 0], [9, 1], [10, 1]],
    "9": [[6, 6], [6, 5], [7, 5], [8, 5], [8, 4], [8, 3]],
    "10": [[7, 1], [6, 1], [5, 1], [4, 1], [3, 1], [3, 2], [2, 2], [2, 3], [2, 4], [1, 4], [1, 5], [0, 5], [0, 6], [0, 7], [0, 8], [0, 9], [0, 10], [10, 5], [10, 4], [9, 4], [9, 3], [9, 2], [10, 2], [11, 2], [11, 1], [11, 0], [10, 0]],
    "11": [[7, 3], [7, 4], [6, 4], [5, 4], [5, 5], [5, 6], [5, 7], [5, 8], [8, 9], [8, 10], [9, 10], [10, 10], [10, 9], [11, 9], [11, 8], [11, 7]]
  },
  "difficulty": {
    "score": 67.7,
    "band": "hard",
    "metrics": {
      "cells": 140,
      "colors": 12,
      "avgPathLength": 11.67,
      "turnDensity": 0.35,
      "maxSolverTier": 4,
      "tierCounts": [110, 0, 13, 5],
      "searchNodes": 20001,
      "forcedMoveRatio": 0.859
    }
  },
  "stars": {
    "perfectMoves": 12,
    "twoStarMoves": 18
  },
  "meta": {
    "seed": 1705887767,
    "generatorVersion": "2.0.0",
    "params": {
      "size": 12,
      "colors": [10, 12],
      "walls": 4,
      "bridges": 0,
      "warps": 0,
      "teleporters": 2,
      "tunnels": 0,
      "rotators": 0,
      "locks": 1
    },
    "loadBearing": true
  }
}
