{
  "$schema": "../../schema/level.schema.json",
  "id": "walls-bridges-warps-teleporters-tunnels-045",
  "pack": "walls-bridges-warps-teleporters-tunnels",
  "index": 45,
  "formatVersion": 2,
  "size": {
    "width": 12,
    "height": 12
  },
  "dots": [
    {
      "color": 10,
      "start": [0, 0],
      "end": [8, 1]
    },
    {
      "color": 5,
      "start": [1, 1],
      "end": [9, 10]
    },
    {
      "color": 4,
      "start": [1, 3],
      "end": [2, 6]
    },
    {
      "color": 6,
      "start": [1, 7],
      "end": [10, 10]
    },
    {
      "color": 2,
      "start": [2, 2],
      "end": [4, 3]
    },
    {
      "color": 9,
      "start": [2, 8],
      "end": [6, 3]
    },
    {
      "color": 7,
      "start": [3, 2],
      "end": [5, 2]
    },
    {
      "color": 3,
      "start": [3, 3],
      "end": [7, 9]
    },
    {
      "color": 8,
      "start": [5, 1],
      "end": [9, 4]
    },
    {
      "color": 0,
      "start": [6, 5],
      "end": [9, 0]
    },
    {
      "color": 1,
      "start": [9, 7],
      "end": [11, 10]
    },
    {
      "color": 11,
      "start": [9, 8],
      "end": [11, 9]
    }
  ],
  "walls": [[1, 2], [3, 0], [2, 7], [8, 0]],
  "bridges": [[4, 8], [5, 4]],
  "warps": [
    {
      "axis": "row",
      "index": 10
    }
  ],
  "teleporters": [
    {
      "a": [3, 9],
      "b": [9, 5]
    }
  ],
  "tunnels": [
    {
      "cell": [8, 4],
      "start": "v"
    }
  ],
  "rotators": [],
  "locks": [],
  "solution": {
    "0": [[0, 0], [1, 0], [2, 0], [2, 1], [3, 1], [4, 1], [4, 0], [5, 0], [6, 0], [7, 0], [7, 1], [8, 1]],
    "1": [[1, 1], [0, 1], [0, 2], [0, 3], [0, 4], [0, 5], [0, 6], [0, 7], [0, 8], [0, 9], [0, 10], [0, 11], [1, 11], [2, 11], [3, 11], [4, 11], [5, 11], [6, 11], [7, 11], [8, 11], [9, 11], [9, 10]],
    "2": [[1, 3], [1, 4], [1, 5], [1, 6], [2, 6]],
    "3": [[1, 7], [1, 8], [1, 9], [1, 10], [2, 10], [3, 10], [4, 10], [5, 10], [6, 10], [7, 10], [8, 10], [8, 9], [9, 9], [10, 9], [10, 10]],
    "4": [[2, 2], [2, 3], [2, 4], [2, 5], [3, 5], [4, 5], [5, 5], [5, 4], [5, 3], [4, 3]],
    "5": [[2, 8], [2, 9], [3, 9], [9, 5], [8, 5], [8, 4], [8, 3], [7, 3], [6, 3]],
    "6": [[3, 2], [4, 2], [5, 2]],
    "7": [[3, 3], [3, 4], [4, 4], [5, 4], [6, 4], [7, 4], [7, 5], [7, 6], [7, 7], [6, 7], [5, 7], [4, 7], [4, 8], [4, 9], [5, 9], [6, 9], [7, 9]],
    "8": [[5, 1], [6, 1], [6, 2], [7, 2], [8, 2], [9, 2], [9, 3], [9, 4]],
    "9": [[6, 5], [6, 6], [5, 6], [4, 6], [3, 6], [3, 7], [3, 8], [4, 8], [5, 8], [6, 8], [7, 8], [8, 8], [8, 7], [8, 6], [9, 6], [10, 6], [10, 5], [10, 4], [10, 3], [10, 2], [10, 1], [9, 1], [9, 0]],
    "10": [[9, 7], [10, 7], [11, 7], [11, 6], [11, 5], [11, 4], [11, 3], [11, 2], [11, 1], [11, 0], [10, 0], [10, 11], [11, 11], [11, 10]],
    "11": [[9, 8], [10, 8], [11, 8], [11, 9]]
  },
  "difficulty": {
    "score": 64.1,
    "band": "hard",
    "metrics": {
      "cells": 140,
      "colors": 12,
      "avgPathLength": 11.83,
      "turnDensity": 0.296,
      "maxSolverTier": 4,
      "tierCounts": [109, 2, 16, 3],
      "searchNodes": 534,
      "forcedMoveRatio": 0.838
    }
  },
  "stars": {
    "perfectMoves": 12,
    "twoStarMoves": 18
  },
  "meta": {
    "seed": 1046084688,
    "generatorVersion": "2.0.0",
    "params": {
      "size": 12,
      "colors": [10, 12],
      "walls": 4,
      "bridges": 2,
      "warps": 1,
      "teleporters": 1,
      "tunnels": 1,
      "rotators": 0,
      "locks": 0
    },
    "loadBearing": true
  }
}
