{
  "$schema": "../../schema/level.schema.json",
  "id": "walls-002",
  "pack": "walls",
  "index": 2,
  "formatVersion": 1,
  "size": {
    "width": 5,
    "height": 5
  },
  "dots": [
    {
      "color": 0,
      "start": [1, 1],
      "end": [1, 3]
    },
    {
      "color": 3,
      "start": [1, 4],
      "end": [4, 0]
    },
    {
      "color": 2,
      "start": [2, 1],
      "end": [4, 1]
    },
    {
      "color": 1,
      "start": [2, 3],
      "end": [3, 4]
    }
  ],
  "walls": [[2, 4], [3, 3]],
  "bridges": [],
  "warps": [],
  "solution": {
    "0": [[1, 1], [1, 2], [1, 3]],
    "1": [[1, 4], [0, 4], [0, 3], [0, 2], [0, 1], [0, 0], [1, 0], [2, 0], [3, 0], [4, 0]],
    "2": [[2, 1], [3, 1], [4, 1]],
    "3": [[2, 3], [2, 2], [3, 2], [4, 2], [4, 3], [4, 4], [3, 4]]
  },
  "difficulty": {
    "score": 7.5,
    "band": "relaxed",
    "metrics": {
      "cells": 23,
      "colors": 4,
      "avgPathLength": 5.75,
      "turnDensity": 0.217,
      "maxSolverTier": 1,
      "tierCounts": [19, 0, 0, 0],
      "searchNodes": 20,
      "forcedMoveRatio": 1
    }
  },
  "stars": {
    "perfectMoves": 4,
    "twoStarMoves": 6
  },
  "meta": {
    "seed": 400170987,
    "generatorVersion": "2.0.0",
    "params": {
      "size": 5,
      "colors": [4, 5],
      "walls": 2,
      "bridges": 0,
      "warps": 0
    }
  }
}
