{
  "$schema": "../../schema/level.schema.json",
  "id": "tunnels-rotators-035",
  "pack": "tunnels-rotators",
  "index": 35,
  "formatVersion": 2,
  "size": {
    "width": 10,
    "height": 10
  },
  "dots": [
    {
      "color": 2,
      "start": [2, 3],
      "end": [2, 9]
    },
    {
      "color": 1,
      "start": [2, 6],
      "end": [4, 7]
    },
    {
      "color": 7,
      "start": [3, 3],
      "end": [9, 2]
    },
    {
      "color": 8,
      "start": [3, 6],
      "end": [8, 8]
    },
    {
      "color": 3,
      "start": [4, 1],
      "end": [8, 4]
    },
    {
      "color": 9,
      "start": [4, 8],
      "end": [5, 7]
    },
    {
      "color": 0,
      "start": [5, 9],
      "end": [8, 5]
    },
    {
      "color": 5,
      "start": [6, 2],
      "end": [9, 0]
    },
    {
      "color": 6,
      "start": [6, 8],
      "end": [8, 2]
    },
    {
      "color": 4,
      "start": [7, 6],
      "end": [8, 7]
    }
  ],
  "walls": [],
  "bridges": [],
  "warps": [],
  "teleporters": [],
  "tunnels": [
    {
      "cell": [9, 7],
      "start": "v"
    },
    {
      "cell": [2, 5],
      "start": "h"
    }
  ],
  "rotators": [
    {
      "cell": [8, 3],
      "start": "se"
    },
    {
      "cell": [1, 8],
      "start": "nw"
    },
    {
      "cell": [7, 1],
      "start": "nw"
    }
  ],
  "locks": [],
  "solution": {
    "0": [[2, 3], [2, 2], [3, 2], [4, 2], [5, 2], [5, 1], [5, 0], [4, 0], [3, 0], [2, 0], [1, 0], [0, 0], [0, 1], [0, 2], [0, 3], [0, 4], [0, 5], [0, 6], [0, 7], [0, 8], [0, 9], [1, 9], [2, 9]],
    "1": [[2, 6], [2, 7], [3, 7], [4, 7]],
    "2": [[3, 3], [4, 3], [5, 3], [6, 3], [7, 3], [7, 2], [7, 1], [8, 1], [9, 1], [9, 2]],
    "3": [[3, 6], [4, 6], [5, 6], [6, 6], [6, 7], [7, 7], [7, 8], [8, 8]],
    "4": [[4, 1], [3, 1], [2, 1], [1, 1], [1, 2], [1, 3], [1, 4], [2, 4], [3, 4], [4, 4], [5, 4], [6, 4], [7, 4], [8, 4]],
    "5": [[4, 8], [5, 8], [5, 7]],
    "6": [[5, 9], [4, 9], [3, 9], [3, 8], [2, 8], [1, 8], [1, 7], [1, 6], [1, 5], [2, 5], [3, 5], [4, 5], [5, 5], [6, 5], [7, 5], [8, 5]],
    "7": [[6, 2], [6, 1], [6, 0], [7, 0], [8, 0], [9, 0]],
    "8": [[6, 8], [6, 9], [7, 9], [8, 9], [9, 9], [9, 8], [9, 7], [9, 6], [9, 5], [9, 4], [9, 3], [8, 3], [8, 2]],
    "9": [[7, 6], [8, 6], [8, 7]]
  },
  "difficulty": {
    "score": 46.5,
    "band": "medium",
    "metrics": {
      "cells": 100,
      "colors": 10,
      "avgPathLength": 10,
      "turnDensity": 0.26,
      "maxSolverTier": 4,
      "tierCounts": [84, 3, 2, 1],
      "searchNodes": 93,
      "forcedMoveRatio": 0.933
    }
  },
  "stars": {
    "perfectMoves": 10,
    "twoStarMoves": 15
  },
  "meta": {
    "seed": 1600890900,
    "generatorVersion": "2.0.0",
    "params": {
      "size": 10,
      "colors": [8, 10],
      "walls": 0,
      "bridges": 0,
      "warps": 0,
      "teleporters": 0,
      "tunnels": 2,
      "rotators": 3,
      "locks": 0
    },
    "loadBearing": true
  }
}
