{
  "$schema": "../../schema/level.schema.json",
  "id": "rotators-013",
  "pack": "rotators",
  "index": 13,
  "formatVersion": 2,
  "size": {
    "width": 7,
    "height": 7
  },
  "dots": [
    {
      "color": 0,
      "start": [1, 1],
      "end": [6, 6]
    },
    {
      "color": 1,
      "start": [1, 2],
      "end": [4, 2]
    },
    {
      "color": 4,
      "start": [1, 5],
      "end": [5, 6]
    },
    {
      "color": 2,
      "start": [2, 6],
      "end": [3, 4]
    },
    {
      "color": 3,
      "start": [3, 3],
      "end": [5, 4]
    }
  ],
  "walls": [],
  "bridges": [],
  "warps": [],
  "teleporters": [],
  "tunnels": [],
  "rotators": [
    {
      "cell": [0, 6],
      "start": "se"
    },
    {
      "cell": [6, 4],
      "start": "se"
    }
  ],
  "locks": [],
  "solution": {
    "0": [[1, 1], [2, 1], [3, 1], [4, 1], [5, 1], [5, 2], [5, 3], [4, 3], [4, 4], [4, 5], [5, 5], [6, 5], [6, 6]],
    "1": [[1, 2], [2, 2], [3, 2], [4, 2]],
    "2": [[1, 5], [2, 5], [3, 5], [3, 6], [4, 6], [5, 6]],
    "3": [[2, 6], [1, 6], [0, 6], [0, 5], [0, 4], [1, 4], [2, 4], [3, 4]],
    "4": [[3, 3], [2, 3], [1, 3], [0, 3], [0, 2], [0, 1], [0, 0], [1, 0], [2, 0], [3, 0], [4, 0], [5, 0], [6, 0], [6, 1], [6, 2], [6, 3], [6, 4], [5, 4]]
  },
  "difficulty": {
    "score": 23.2,
    "band": "easy",
    "metrics": {
      "cells": 49,
      "colors": 5,
      "avgPathLength": 9.8,
      "turnDensity": 0.265,
      "maxSolverTier": 2,
      "tierCounts": [43, 1, 0, 0],
      "searchNodes": 170,
      "forcedMoveRatio": 0.977
    }
  },
  "stars": {
    "perfectMoves": 5,
    "twoStarMoves": 8
  },
  "meta": {
    "seed": 1696735915,
    "generatorVersion": "2.0.0",
    "params": {
      "size": 7,
      "colors": [5, 7],
      "walls": 0,
      "bridges": 0,
      "warps": 0,
      "teleporters": 0,
      "tunnels": 0,
      "rotators": 2,
      "locks": 0
    },
    "loadBearing": true
  }
}
