{
  "$schema": "../../schema/level.schema.json",
  "id": "bridges-019",
  "pack": "bridges",
  "index": 19,
  "formatVersion": 1,
  "size": {
    "width": 8,
    "height": 8
  },
  "dots": [
    {
      "color": 2,
      "start": [1, 0],
      "end": [2, 7]
    },
    {
      "color": 4,
      "start": [1, 1],
      "end": [2, 6]
    },
    {
      "color": 0,
      "start": [1, 6],
      "end": [4, 7]
    },
    {
      "color": 7,
      "start": [2, 0],
      "end": [5, 1]
    },
    {
      "color": 6,
      "start": [2, 1],
      "end": [4, 4]
    },
    {
      "color": 1,
      "start": [4, 5],
      "end": [6, 6]
    },
    {
      "color": 3,
      "start": [4, 6],
      "end": [5, 0]
    },
    {
      "color": 5,
      "start": [6, 3],
      "end": [7, 0]
    }
  ],
  "walls": [],
  "bridges": [[2, 3]],
  "warps": [],
  "solution": {
    "0": [[1, 0], [0, 0], [0, 1], [0, 2], [0, 3], [0, 4], [0, 5], [0, 6], [0, 7], [1, 7], [2, 7]],
    "1": [[1, 1], [1, 2], [2, 2], [2, 3], [2, 4], [2, 5], [2, 6]],
    "2": [[1, 6], [1, 5], [1, 4], [1, 3], [2, 3], [3, 3], [3, 4], [3, 5], [3, 6], [3, 7], [4, 7]],
    "3": [[2, 0], [3, 0], [4, 0], [4, 1], [5, 1]],
    "4": [[2, 1], [3, 1], [3, 2], [4, 2], [4, 3], [4, 4]],
    "5": [[4, 5], [5, 5], [6, 5], [6, 6]],
    "6": [[4, 6], [5, 6], [5, 7], [6, 7], [7, 7], [7, 6], [7, 5], [7, 4], [6, 4], [5, 4], [5, 3], [5, 2], [6, 2], [6, 1], [6, 0], [5, 0]],
    "7": [[6, 3], [7, 3], [7, 2], [7, 1], [7, 0]]
  },
  "difficulty": {
    "score": 31.7,
    "band": "easy",
    "metrics": {
      "cells": 64,
      "colors": 8,
      "avgPathLength": 8.13,
      "turnDensity": 0.338,
      "maxSolverTier": 3,
      "tierCounts": [54, 0, 3, 0],
      "searchNodes": 79,
      "forcedMoveRatio": 0.947
    }
  },
  "stars": {
    "perfectMoves": 8,
    "twoStarMoves": 12
  },
  "meta": {
    "seed": 745444725,
    "generatorVersion": "2.0.0",
    "params": {
      "size": 8,
      "colors": [6, 8],
      "walls": 0,
      "bridges": 1,
      "warps": 0
    }
  }
}
