{
  "$schema": "../../schema/level.schema.json",
  "id": "tunnels-013",
  "pack": "tunnels",
  "index": 13,
  "formatVersion": 2,
  "size": {
    "width": 7,
    "height": 7
  },
  "dots": [
    {
      "color": 6,
      "start": [0, 4],
      "end": [1, 2]
    },
    {
      "color": 3,
      "start": [0, 6],
      "end": [3, 5]
    },
    {
      "color": 0,
      "start": [1, 1],
      "end": [4, 4]
    },
    {
      "color": 4,
      "start": [1, 3],
      "end": [2, 0]
    },
    {
      "color": 1,
      "start": [1, 6],
      "end": [5, 4]
    },
    {
      "color": 2,
      "start": [3, 0],
      "end": [5, 2]
    },
    {
      "color": 5,
      "start": [5, 1],
      "end": [5, 6]
    }
  ],
  "walls": [],
  "bridges": [],
  "warps": [],
  "teleporters": [],
  "tunnels": [
    {
      "cell": [4, 0],
      "start": "h"
    }
  ],
  "rotators": [],
  "locks": [],
  "solution": {
    "0": [[0, 4], [1, 4], [2, 4], [2, 3], [2, 2], [1, 2]],
    "1": [[0, 6], [0, 5], [1, 5], [2, 5], [3, 5]],
    "2": [[1, 1], [2, 1], [3, 1], [3, 2], [3, 3], [3, 4], [4, 4]],
    "3": [[1, 3], [0, 3], [0, 2], [0, 1], [0, 0], [1, 0], [2, 0]],
    "4": [[1, 6], [2, 6], [3, 6], [4, 6], [4, 5], [5, 5], [5, 4]],
    "5": [[3, 0], [4, 0], [5, 0], [6, 0], [6, 1], [6, 2], [5, 2]],
    "6": [[5, 1], [4, 1], [4, 2], [4, 3], [5, 3], [6, 3], [6, 4], [6, 5], [6, 6], [5, 6]]
  },
  "difficulty": {
    "score": 26.8,
    "band": "easy",
    "metrics": {
      "cells": 49,
      "colors": 7,
      "avgPathLength": 7,
      "turnDensity": 0.327,
      "maxSolverTier": 3,
      "tierCounts": [40, 0, 2, 0],
      "searchNodes": 45,
      "forcedMoveRatio": 0.952
    }
  },
  "stars": {
    "perfectMoves": 7,
    "twoStarMoves": 11
  },
  "meta": {
    "seed": 957322634,
    "generatorVersion": "2.0.0",
    "params": {
      "size": 7,
      "colors": [5, 7],
      "walls": 0,
      "bridges": 0,
      "warps": 0,
      "teleporters": 0,
      "tunnels": 1,
      "rotators": 0,
      "locks": 0
    },
    "loadBearing": true
  }
}
