{
  "$schema": "../../schema/level.schema.json",
  "id": "bridges-warps-rotators-locks-040",
  "pack": "bridges-warps-rotators-locks",
  "index": 40,
  "formatVersion": 2,
  "size": {
    "width": 11,
    "height": 11
  },
  "dots": [
    {
      "color": 7,
      "start": [0, 5],
      "end": [2, 10]
    },
    {
      "color": 9,
      "start": [1, 5],
      "end": [3, 10]
    },
    {
      "color": 10,
      "start": [2, 2],
      "end": [4, 9]
    },
    {
      "color": 5,
      "start": [2, 8],
      "end": [5, 0]
    },
    {
      "color": 2,
      "start": [3, 2],
      "end": [3, 8]
    },
    {
      "color": 3,
      "start": [6, 6],
      "end": [9, 6]
    },
    {
      "color": 1,
      "start": [7, 1],
      "end": [8, 2]
    },
    {
      "color": 4,
      "start": [7, 7],
      "end": [8, 5]
    },
    {
      "color": 0,
      "start": [9, 0],
      "end": [10, 7]
    },
    {
      "color": 6,
      "start": [9, 2],
      "end": [10, 6]
    },
    {
      "color": 8,
      "start": [10, 4],
      "end": [10, 9]
    }
  ],
  "walls": [],
  "bridges": [[4, 4], [7, 4]],
  "warps": [
    {
      "axis": "col",
      "index": 4
    },
    {
      "axis": "row",
      "index": 4
    }
  ],
  "teleporters": [],
  "tunnels": [],
  "rotators": [
    {
      "cell": [9, 8],
      "start": "ne"
    },
    {
      "cell": [9, 4],
      "start": "sw"
    }
  ],
  "locks": [
    {
      "key": [7, 9],
      "door": [6, 1]
    }
  ],
  "solution": {
    "0": [[0, 5], [0, 6], [0, 7], [0, 8], [0, 9], [0, 10], [1, 10], [2, 10]],
    "1": [[1, 5], [1, 6], [1, 7], [1, 8], [1, 9], [2, 9], [3, 9], [3, 10]],
    "2": [[2, 2], [2, 3], [3, 3], [4, 3], [4, 4], [4, 5], [4, 6], [4, 7], [4, 8], [4, 9]],
    "3": [[2, 8], [2, 7], [2, 6], [2, 5], [2, 4], [1, 4], [1, 3], [1, 2], [1, 1], [2, 1], [3, 1], [4, 1], [5, 1], [5, 0]],
    "4": [[3, 2], [4, 2], [5, 2], [5, 3], [5, 4], [4, 4], [3, 4], [3, 5], [3, 6], [3, 7], [3, 8]],
    "5": [[6, 6], [6, 7], [6, 8], [7, 8], [8, 8], [8, 7], [9, 7], [9, 6]],
    "6": [[7, 1], [7, 2], [8, 2]],
    "7": [[7, 7], [7, 6], [8, 6], [8, 5]],
    "8": [[9, 0], [10, 0], [10, 1], [10, 2], [10, 3], [9, 3], [8, 3], [7, 3], [7, 4], [7, 5], [6, 5], [5, 5], [5, 6], [5, 7], [5, 8], [5, 9], [6, 9], [7, 9], [8, 9], [9, 9], [9, 8], [10, 8], [10, 7]],
    "9": [[9, 2], [9, 1], [8, 1], [8, 0], [7, 0], [6, 0], [6, 1], [6, 2], [6, 3], [6, 4], [7, 4], [8, 4], [9, 4], [9, 5], [10, 5], [10, 6]],
    "10": [[10, 4], [0, 4], [0, 3], [0, 2], [0, 1], [0, 0], [1, 0], [2, 0], [3, 0], [4, 0], [4, 10], [5, 10], [6, 10], [7, 10], [8, 10], [9, 10], [10, 10], [10, 9]]
  },
  "difficulty": {
    "score": 64,
    "band": "hard",
    "metrics": {
      "cells": 121,
      "colors": 11,
      "avgPathLength": 11.18,
      "turnDensity": 0.333,
      "maxSolverTier": 4,
      "tierCounts": [98, 3, 9, 2],
      "searchNodes": 20001,
      "forcedMoveRatio": 0.875
    }
  },
  "stars": {
    "perfectMoves": 11,
    "twoStarMoves": 17
  },
  "meta": {
    "seed": 2886318549,
    "generatorVersion": "2.0.0",
    "params": {
      "size": 11,
      "colors": [9, 11],
      "walls": 0,
      "bridges": 2,
      "warps": 2,
      "teleporters": 0,
      "tunnels": 0,
      "rotators": 2,
      "locks": 1
    },
    "loadBearing": true
  }
}
