{
  "$schema": "../../schema/level.schema.json",
  "id": "none-048",
  "pack": "none",
  "index": 48,
  "formatVersion": 1,
  "size": {
    "width": 8,
    "height": 8
  },
  "dots": [
    {
      "color": 3,
      "start": [2, 2],
      "end": [2, 4]
    },
    {
      "color": 6,
      "start": [2, 5],
      "end": [6, 0]
    },
    {
      "color": 4,
      "start": [3, 4],
      "end": [6, 5]
    },
    {
      "color": 0,
      "start": [3, 6],
      "end": [6, 2]
    },
    {
      "color": 2,
      "start": [3, 7],
      "end": [5, 2]
    },
    {
      "color": 1,
      "start": [4, 6],
      "end": [7, 7]
    },
    {
      "color": 5,
      "start": [5, 0],
      "end": [6, 1]
    }
  ],
  "walls": [],
  "bridges": [],
  "warps": [],
  "solution": {
    "0": [[2, 2], [2, 3], [2, 4]],
    "1": [[2, 5], [3, 5], [4, 5], [5, 5], [5, 6], [6, 6], [7, 6], [7, 5], [7, 4], [7, 3], [7, 2], [7, 1], [7, 0], [6, 0]],
    "2": [[3, 4], [4, 4], [5, 4], [6, 4], [6, 5]],
    "3": [[3, 6], [2, 6], [1, 6], [1, 5], [1, 4], [1, 3], [1, 2], [1, 1], [2, 1], [3, 1], [3, 2], [3, 3], [4, 3], [5, 3], [6, 3], [6, 2]],
    "4": [[3, 7], [2, 7], [1, 7], [0, 7], [0, 6], [0, 5], [0, 4], [0, 3], [0, 2], [0, 1], [0, 0], [1, 0], [2, 0], [3, 0], [4, 0], [4, 1], [4, 2], [5, 2]],
    "5": [[4, 6], [4, 7], [5, 7], [6, 7], [7, 7]],
    "6": [[5, 0], [5, 1], [6, 1]]
  },
  "difficulty": {
    "score": 37.3,
    "band": "medium",
    "metrics": {
      "cells": 64,
      "colors": 7,
      "avgPathLength": 9.14,
      "turnDensity": 0.25,
      "maxSolverTier": 4,
      "tierCounts": [53, 1, 2, 1],
      "searchNodes": 72,
      "forcedMoveRatio": 0.93
    }
  },
  "stars": {
    "perfectMoves": 7,
    "twoStarMoves": 11
  },
  "meta": {
    "seed": 3569898218,
    "generatorVersion": "2.0.0",
    "params": {
      "size": 8,
      "colors": [7, 8],
      "walls": 0,
      "bridges": 0,
      "warps": 0
    }
  }
}
