{
  "$schema": "../../schema/level.schema.json",
  "id": "walls-warps-rotators-016",
  "pack": "walls-warps-rotators",
  "index": 16,
  "formatVersion": 2,
  "size": {
    "width": 7,
    "height": 7
  },
  "dots": [
    {
      "color": 1,
      "start": [0, 3],
      "end": [4, 3]
    },
    {
      "color": 4,
      "start": [1, 0],
      "end": [1, 2]
    },
    {
      "color": 0,
      "start": [1, 3],
      "end": [5, 1]
    },
    {
      "color": 2,
      "start": [1, 5],
      "end": [2, 0]
    },
    {
      "color": 3,
      "start": [3, 0],
      "end": [5, 3]
    },
    {
      "color": 5,
      "start": [3, 5],
      "end": [5, 5]
    }
  ],
  "walls": [[0, 0]],
  "bridges": [],
  "warps": [
    {
      "axis": "col",
      "index": 1
    }
  ],
  "teleporters": [],
  "tunnels": [],
  "rotators": [
    {
      "cell": [0, 4],
      "start": "nw"
    }
  ],
  "locks": [],
  "solution": {
    "0": [[0, 3], [0, 2], [0, 1], [6, 1], [6, 0], [5, 0], [4, 0], [4, 1], [4, 2], [4, 3]],
    "1": [[1, 0], [1, 1], [1, 2]],
    "2": [[1, 3], [1, 4], [0, 4], [0, 5], [0, 6], [1, 6], [2, 6], [3, 6], [4, 6], [5, 6], [6, 6], [6, 5], [6, 4], [6, 3], [6, 2], [5, 2], [5, 1]],
    "3": [[1, 5], [2, 5], [2, 4], [2, 3], [2, 2], [2, 1], [2, 0]],
    "4": [[3, 0], [3, 1], [3, 2], [3, 3], [3, 4], [4, 4], [5, 4], [5, 3]],
    "5": [[3, 5], [4, 5], [5, 5]]
  },
  "difficulty": {
    "score": 36,
    "band": "medium",
    "metrics": {
      "cells": 48,
      "colors": 6,
      "avgPathLength": 8,
      "turnDensity": 0.271,
      "maxSolverTier": 4,
      "tierCounts": [41, 0, 0, 1],
      "searchNodes": 43,
      "forcedMoveRatio": 0.976
    }
  },
  "stars": {
    "perfectMoves": 6,
    "twoStarMoves": 9
  },
  "meta": {
    "seed": 2860734521,
    "generatorVersion": "2.0.0",
    "params": {
      "size": 7,
      "colors": [5, 7],
      "walls": 1,
      "bridges": 0,
      "warps": 1,
      "teleporters": 0,
      "tunnels": 0,
      "rotators": 1,
      "locks": 0
    },
    "loadBearing": true
  }
}
