{
  "$schema": "../../schema/level.schema.json",
  "id": "teleporters-033",
  "pack": "teleporters",
  "index": 33,
  "formatVersion": 2,
  "size": {
    "width": 10,
    "height": 10
  },
  "dots": [
    {
      "color": 7,
      "start": [0, 0],
      "end": [1, 5]
    },
    {
      "color": 4,
      "start": [0, 7],
      "end": [5, 8]
    },
    {
      "color": 1,
      "start": [2, 1],
      "end": [8, 0]
    },
    {
      "color": 0,
      "start": [3, 1],
      "end": [5, 9]
    },
    {
      "color": 6,
      "start": [3, 9],
      "end": [7, 8]
    },
    {
      "color": 5,
      "start": [5, 2],
      "end": [8, 9]
    },
    {
      "color": 2,
      "start": [6, 6],
      "end": [9, 0]
    },
    {
      "color": 3,
      "start": [7, 9],
      "end": [8, 3]
    }
  ],
  "walls": [],
  "bridges": [],
  "warps": [],
  "teleporters": [
    {
      "a": [6, 4],
      "b": [0, 1]
    },
    {
      "a": [0, 9],
      "b": [3, 3]
    }
  ],
  "tunnels": [],
  "rotators": [],
  "locks": [],
  "solution": {
    "0": [[0, 0], [1, 0], [1, 1], [1, 2], [1, 3], [1, 4], [1, 5]],
    "1": [[0, 7], [0, 8], [0, 9], [3, 3], [3, 4], [3, 5], [3, 6], [3, 7], [4, 7], [5, 7], [5, 8]],
    "2": [[2, 1], [2, 0], [3, 0], [4, 0], [5, 0], [6, 0], [7, 0], [8, 0]],
    "3": [[3, 1], [3, 2], [2, 2], [2, 3], [2, 4], [2, 5], [2, 6], [2, 7], [2, 8], [3, 8], [4, 8], [4, 9], [5, 9]],
    "4": [[3, 9], [2, 9], [1, 9], [1, 8], [1, 7], [1, 6], [0, 6], [0, 5], [0, 4], [0, 3], [0, 2], [0, 1], [6, 4], [7, 4], [8, 4], [8, 5], [8, 6], [8, 7], [8, 8], [7, 8]],
    "5": [[5, 2], [6, 2], [7, 2], [8, 2], [9, 2], [9, 3], [9, 4], [9, 5], [9, 6], [9, 7], [9, 8], [9, 9], [8, 9]],
    "6": [[6, 6], [5, 6], [4, 6], [4, 5], [4, 4], [4, 3], [4, 2], [4, 1], [5, 1], [6, 1], [7, 1], [8, 1], [9, 1], [9, 0]],
    "7": [[7, 9], [6, 9], [6, 8], [6, 7], [7, 7], [7, 6], [7, 5], [6, 5], [5, 5], [5, 4], [5, 3], [6, 3], [7, 3], [8, 3]]
  },
  "difficulty": {
    "score": 50.7,
    "band": "medium",
    "metrics": {
      "cells": 100,
      "colors": 8,
      "avgPathLength": 12.5,
      "turnDensity": 0.25,
      "maxSolverTier": 4,
      "tierCounts": [85, 0, 3, 4],
      "searchNodes": 111,
      "forcedMoveRatio": 0.924
    }
  },
  "stars": {
    "perfectMoves": 8,
    "twoStarMoves": 12
  },
  "meta": {
    "seed": 2223671943,
    "generatorVersion": "2.0.0",
    "params": {
      "size": 10,
      "colors": [8, 10],
      "walls": 0,
      "bridges": 0,
      "warps": 0,
      "teleporters": 2,
      "tunnels": 0,
      "rotators": 0,
      "locks": 0
    }
  }
}
