{
  "$schema": "../../schema/level.schema.json",
  "id": "warps-032",
  "pack": "warps",
  "index": 32,
  "formatVersion": 1,
  "size": {
    "width": 10,
    "height": 10
  },
  "dots": [
    {
      "color": 5,
      "start": [0, 6],
      "end": [5, 0]
    },
    {
      "color": 6,
      "start": [1, 3],
      "end": [5, 9]
    },
    {
      "color": 2,
      "start": [1, 8],
      "end": [8, 5]
    },
    {
      "color": 4,
      "start": [2, 0],
      "end": [4, 0]
    },
    {
      "color": 8,
      "start": [2, 2],
      "end": [6, 2]
    },
    {
      "color": 9,
      "start": [2, 7],
      "end": [9, 0]
    },
    {
      "color": 0,
      "start": [3, 8],
      "end": [9, 8]
    },
    {
      "color": 7,
      "start": [4, 8],
      "end": [6, 9]
    },
    {
      "color": 1,
      "start": [5, 6],
      "end": [7, 6]
    },
    {
      "color": 3,
      "start": [8, 6],
      "end": [8, 8]
    }
  ],
  "walls": [],
  "bridges": [],
  "warps": [
    {
      "axis": "col",
      "index": 7
    },
    {
      "axis": "row",
      "index": 3
    }
  ],
  "solution": {
    "0": [[0, 6], [0, 5], [1, 5], [2, 5], [3, 5], [3, 4], [4, 4], [5, 4], [6, 4], [7, 4], [8, 4], [8, 3], [8, 2], [8, 1], [8, 0], [7, 0], [6, 0], [5, 0]],
    "1": [[1, 3], [1, 2], [1, 1], [2, 1], [3, 1], [3, 0], [3, 9], [4, 9], [5, 9]],
    "2": [[1, 8], [1, 7], [1, 6], [2, 6], [3, 6], [4, 6], [4, 5], [5, 5], [6, 5], [7, 5], [8, 5]],
    "3": [[2, 0], [1, 0], [0, 0], [0, 1], [0, 2], [0, 3], [0, 4], [1, 4], [2, 4], [2, 3], [3, 3], [4, 3], [5, 3], [6, 3], [7, 3], [7, 2], [7, 1], [6, 1], [5, 1], [4, 1], [4, 0]],
    "4": [[2, 2], [3, 2], [4, 2], [5, 2], [6, 2]],
    "5": [[2, 7], [2, 8], [2, 9], [1, 9], [0, 9], [0, 8], [0, 7], [9, 7], [9, 6], [9, 5], [9, 4], [9, 3], [9, 2], [9, 1], [9, 0]],
    "6": [[3, 8], [3, 7], [4, 7], [5, 7], [6, 7], [7, 7], [7, 8], [7, 9], [8, 9], [9, 9], [9, 8]],
    "7": [[4, 8], [5, 8], [6, 8], [6, 9]],
    "8": [[5, 6], [6, 6], [7, 6]],
    "9": [[8, 6], [8, 7], [8, 8]]
  },
  "difficulty": {
    "score": 51.4,
    "band": "medium",
    "metrics": {
      "cells": 100,
      "colors": 10,
      "avgPathLength": 10,
      "turnDensity": 0.27,
      "maxSolverTier": 4,
      "tierCounts": [84, 0, 3, 3],
      "searchNodes": 1567,
      "forcedMoveRatio": 0.933
    }
  },
  "stars": {
    "perfectMoves": 10,
    "twoStarMoves": 15
  },
  "meta": {
    "seed": 542826737,
    "generatorVersion": "2.0.0",
    "params": {
      "size": 10,
      "colors": [8, 10],
      "walls": 0,
      "bridges": 0,
      "warps": 2
    }
  }
}
